{
  "schema_version": 1,
  "map_id": "demo:map/training-ground",
  "geometry_revision": 1,
  "width": 6,
  "height": 5,
  "tile_size": 32,
  "origin": { "x": 64, "y": 96 },
  "axis": "x_right_y_down",
  "order": "row_major",
  "diagonal_policy": "no_corner_cutting",
  "grid": [
    [0, 0, 0, 0, 0, 0],
    [0, 1, 1, 0, 1, 0],
    [0, 1, 0, 0, 1, 0],
    [0, 0, 0, 0, 0, 0],
    [0, 0, 0, 0, 0, 0]
  ],
  "anchors": [
    { "placement_id": "arrival", "kind": "spawn", "cell": {"x": 0, "y": 0}, "extent": {"x": 1, "y": 1} },
    { "placement_id": "guide", "kind": "npc", "cell": {"x": 2, "y": 2}, "extent": {"x": 1, "y": 1} },
    { "placement_id": "portal", "kind": "portal", "cell": {"x": 5, "y": 4}, "extent": {"x": 1, "y": 1} },
    { "placement_id": "training-area", "kind": "trigger", "cell": {"x": 0, "y": 3}, "extent": {"x": 2, "y": 2} }
  ]
}
